{
  "$schema": "../schemas/backlog.schema.json",
  "schema_version": 1,
  "tracker_version": "1.0.0",
  "baseline": "kova-0.29.0",
  "objective": "Resolve every pinned-baseline parity row into an approved, evidenced, cross-platform Product Contract disposition without treating the reference implementation as the specification.",
  "completion_definition": [
    "The pinned baseline census is reviewed, signed, and closed.",
    "Every parity-ledger row links to a stable Product Contract requirement; no contract field remains null.",
    "Every manifest capability is approved or active and declares accepted Windows, macOS, and Linux dispositions.",
    "Persisted formats and integrations have compatibility policy, fixtures, and runtime-observation evidence where applicable.",
    "Conformance coverage traces normative requirements to independent evidence and all required human approvals are recorded.",
    "No unresolved deviation, waiver, security review, privacy review, accessibility review, or product-owner decision remains unowned."
  ],
  "waves": [
    { "id": "D01", "sequence": 1, "target_date": "2026-09-01", "title": "Governance and baseline", "goal": "Record approved contract definitions and close the census boundary when its evidence is accepted.", "package_ids": ["PC-GOVERNANCE-001"] },
    { "id": "D02", "sequence": 2, "target_date": "2026-09-02", "title": "Application and configuration", "goal": "Specify application lifecycle, settings ownership, identity, secrets, and security behavior.", "package_ids": ["PC-APP-SHELL-001", "PC-CONFIG-SECURITY-001"] },
    { "id": "D03", "sequence": 3, "target_date": "2026-09-03", "title": "Capture and workflow engine", "goal": "Complete capture families and the execution semantics that compose them.", "package_ids": ["PC-CAPTURE-001", "PC-WORKFLOW-ENGINE-001"] },
    { "id": "D04", "sequence": 4, "target_date": "2026-09-04", "title": "Recording and media", "goal": "Specify recording, encoding, playback, and media-editor behavior.", "package_ids": ["PC-RECORDING-001", "PC-MEDIA-001"] },
    { "id": "D05", "sequence": 5, "target_date": "2026-09-05", "title": "Uploads and destinations", "goal": "Define transfer behavior, destination surfaces, credentials, and compatible uploader data.", "package_ids": ["PC-UPLOADS-001", "PC-DESTINATION-SURFACES-001", "PC-COMPAT-DESTINATIONS-001"] },
    { "id": "D06", "sequence": 6, "target_date": "2026-09-06", "title": "History and indexing", "goal": "Define task history, search, retention, thumbnails, and compatible history data.", "package_ids": ["PC-HISTORY-001", "PC-COMPAT-HISTORY-001"] },
    { "id": "D07", "sequence": 7, "target_date": "2026-09-07", "title": "Automation interfaces", "goal": "Define automation, CLI, MCP, and compatibility boundaries together.", "package_ids": ["PC-AUTOMATION-001", "PC-CLI-SURFACES-001", "PC-MCP-SURFACES-001", "PC-COMPAT-AUTOMATION-001"] },
    { "id": "D08", "sequence": 8, "target_date": "2026-09-08", "title": "Settings catalog", "goal": "Resolve the complete settings inventory and configuration compatibility policy.", "package_ids": ["PC-SETTINGS-CATALOG-001", "PC-COMPAT-CONFIG-001"] },
    { "id": "D09", "sequence": 9, "target_date": "2026-09-09", "title": "Workflow catalog", "goal": "Resolve every inventoried workflow and action surface against stable behavior.", "package_ids": ["PC-WORKFLOW-CATALOG-001"] },
    { "id": "D10", "sequence": 10, "target_date": "2026-09-10", "title": "GUI surfaces", "goal": "Resolve all remaining user-facing GUI surfaces, accessibility, and platform disposition.", "package_ids": ["PC-GUI-SURFACES-001"] },
    { "id": "D11", "sequence": 11, "target_date": "2026-09-11", "title": "Operations and edge domains", "goal": "Close diagnostics, distribution, experimental mobile, and image-effect compatibility decisions.", "package_ids": ["PC-DIAGNOSTICS-001", "PC-DISTRIBUTION-001", "PC-MOBILE-DISPOSITION-001", "PC-COMPAT-IMAGE-EFFECTS-001"] },
    { "id": "D12", "sequence": 12, "target_date": "2026-09-12", "title": "Conformance and closure", "goal": "Prove full traceability, cross-platform disposition, runtime compatibility, and approval closure.", "package_ids": ["PC-CONFORMANCE-001"] }
  ],
  "packages": [
    {
      "id": "PC-GOVERNANCE-001", "title": "Baseline review and contract governance", "kind": "manual", "status": "in_progress", "priority": "P0", "wave": "D01", "owner_role": "contract-steward", "approval": "product-owner", "depends_on": [],
      "deliverables": ["Signed baseline provenance and census review", "Durable approval disposition for all current capability packages", "Named reviewers for security, privacy, accessibility, compatibility, and platform questions"],
      "exit_criteria": ["The baseline census status is closed with product-owner evidence", "Contract-writing and approval responsibilities are unambiguous", "A durable product-owner approval record covers every current package"]
    },
    {
      "id": "PC-APP-SHELL-001", "title": "Application shell and lifecycle", "kind": "ledger", "status": "planned", "priority": "P0", "wave": "D02", "owner_role": "contract-author", "approval": "product-owner", "depends_on": ["PC-GOVERNANCE-001"],
      "deliverables": ["Application lifecycle and single-instance capability package", "Tray, hotkey, notification, update, and shutdown behavior evidence"],
      "exit_criteria": ["All assigned capability rows link to stable requirements", "Windows, macOS, and Linux dispositions and accessibility behavior are accepted"]
    },
    {
      "id": "PC-CONFIG-SECURITY-001", "title": "Configuration, identity, secrets, and security", "kind": "ledger", "status": "planned", "priority": "P0", "wave": "D02", "owner_role": "security-reviewer", "approval": "product-owner", "depends_on": ["PC-GOVERNANCE-001"],
      "deliverables": ["Configuration ownership and migration capability package", "Credential storage, secret redaction, permission, and product-identity requirements"],
      "exit_criteria": ["All assigned capability rows link to stable requirements", "Security and privacy review is recorded", "All supported platforms have accepted secure-storage dispositions"]
    },
    {
      "id": "PC-CAPTURE-001", "title": "Capture families and permissions", "kind": "ledger", "status": "planned", "priority": "P0", "wave": "D03", "owner_role": "contract-author", "approval": "product-owner", "depends_on": ["PC-GOVERNANCE-001"],
      "deliverables": ["Full-screen, window, monitor, scrolling, text, and extended capture packages", "Permission, cancellation, cursor, delay, DPI, and multi-display test vectors"],
      "exit_criteria": ["All assigned capability rows link to stable requirements", "All capture permission and degraded-mode paths are accepted per platform"]
    },
    {
      "id": "PC-WORKFLOW-ENGINE-001", "title": "Workflow engine semantics", "kind": "ledger", "status": "planned", "priority": "P0", "wave": "D03", "owner_role": "contract-author", "approval": "product-owner", "depends_on": ["PC-GOVERNANCE-001"],
      "deliverables": ["Workflow composition, ordering, failure, cancellation, and result semantics", "Deterministic workflow execution scenarios"],
      "exit_criteria": ["All assigned capability rows link to stable requirements", "Execution and failure semantics are accepted independently of any platform implementation"]
    },
    {
      "id": "PC-RECORDING-001", "title": "Screen recording and encoding", "kind": "ledger", "status": "planned", "priority": "P0", "wave": "D04", "owner_role": "contract-author", "approval": "product-owner", "depends_on": ["PC-CAPTURE-001", "PC-WORKFLOW-ENGINE-001"],
      "deliverables": ["Screen, GIF, and device recording capability packages", "Codec, audio, frame timing, pause, cancellation, and failure evidence"],
      "exit_criteria": ["All assigned capability rows link to stable requirements", "Encoder availability and degraded platform dispositions are accepted"]
    },
    {
      "id": "PC-MEDIA-001", "title": "Video editor and media utilities", "kind": "ledger", "status": "planned", "priority": "P1", "wave": "D04", "owner_role": "contract-author", "approval": "product-owner", "depends_on": ["PC-RECORDING-001"],
      "deliverables": ["Video editing, playback, conversion, and media utility packages", "Format, quality, cancellation, and round-trip fixtures"],
      "exit_criteria": ["All assigned capability rows link to stable requirements", "Media format and dependency dispositions are accepted on every platform"]
    },
    {
      "id": "PC-UPLOADS-001", "title": "Upload execution and destination behavior", "kind": "ledger", "status": "planned", "priority": "P0", "wave": "D05", "owner_role": "integration-reviewer", "approval": "product-owner", "depends_on": ["PC-CONFIG-SECURITY-001", "PC-WORKFLOW-ENGINE-001"],
      "deliverables": ["Upload transport, retry, cancellation, progress, result, and error packages", "Credential and privacy requirements for destination execution"],
      "exit_criteria": ["All assigned capability rows link to stable requirements", "Secret handling and network failure scenarios have accepted evidence"]
    },
    {
      "id": "PC-DESTINATION-SURFACES-001", "title": "Destination provider surfaces", "kind": "ledger", "status": "planned", "priority": "P1", "wave": "D05", "owner_role": "integration-reviewer", "approval": "product-owner", "depends_on": ["PC-UPLOADS-001"],
      "deliverables": ["Provider configuration and capability profiles", "Authentication, validation, testing, and removal surface requirements"],
      "exit_criteria": ["All assigned interface rows link to stable requirements", "Provider availability and substitute behavior are accepted per platform"]
    },
    {
      "id": "PC-COMPAT-DESTINATIONS-001", "title": "Uploader and plugin compatibility", "kind": "ledger", "status": "planned", "priority": "P0", "wave": "D05", "owner_role": "compatibility-reviewer", "approval": "product-owner", "depends_on": ["PC-UPLOADS-001"],